{
  "$defs": {
    "metadata": {
      "additionalProperties": false,
      "type": "object",
      "required": [
        "version",
        "domain",
        "user_id",
        "received_at",
        "source"
      ],
      "properties": {
        "domain": {
          "type": "string"
        },
        "received_at": {
          "type": "string",
          "format": "date-time"
        },
        "version": {
          "type": "string",
          "const": "v1"
        },
        "source": {
          "additionalProperties": true,
          "type": "object",
          "required": [
            "provider"
          ],
          "properties": {
            "delivery_id": {
              "type": "string"
            },
            "provider": {
              "type": "string"
            },
            "event_id": {
              "type": "string"
            }
          }
        },
        "user_id": {
          "type": "string",
          "minLength": 1
        }
      }
    }
  },
  "required": [
    "version",
    "domain",
    "user_id",
    "received_at",
    "source",
    "samples"
  ],
  "$schema": "http://json-schema.org/draft-07/schema#",
  "$id": "https://athlete-ally.dev/schemas/normalized/steps.v1.json",
  "title": "Normalized steps v1",
  "additionalProperties": false,
  "type": "object",
  "properties": {
    "version": {
      "type": "string",
      "const": "v1"
    },
    "user_id": {
      "type": "string"
    },
    "received_at": {
      "type": "string",
      "format": "date-time"
    },
    "source": {
      "$ref": "#/$defs/metadata/properties/source"
    },
    "samples": {
      "type": "array",
      "items": {
        "additionalProperties": false,
        "type": "object",
        "required": [
          "timestamp",
          "steps"
        ],
        "properties": {
          "window_sec": {
            "type": "integer",
            "minimum": 1
          },
          "timestamp": {
            "type": "string",
            "format": "date-time"
          },
          "steps": {
            "type": "integer",
            "minimum": 0
          }
        }
      }
    },
    "domain": {
      "type": "string",
      "const": "steps"
    },
    "summary": {
      "additionalProperties": false,
      "type": "object",
      "properties": {
        "total": {
          "type": "integer",
          "minimum": 0
        }
      }
    }
  }
}
